Question,Answer,CorrectResponse,CorrectAnswer,IncorrectAnswer,InfoRepeated,comprehension_questions_1.thisRepN,comprehension_questions_1.thisTrialN,comprehension_questions_1.thisN,comprehension_questions_1.thisIndex,experiment_information_text.started,experiment_information_text.stopped,experiment_information_key.keys,experiment_information_key.rt,experiment_information_key.started,experiment_information_key.stopped,experiment_information_continue.started,experiment_information_continue.stopped,comprehension_question_text.started,comprehension_question_text.stopped,comprehension_question_answers.started,comprehension_question_answers.stopped,comprehension_key.keys,comprehension_key.corr,comprehension_key.rt,comprehension_key.started,comprehension_key.stopped,comprehension_feedback_text.started,comprehension_feedback_text.stopped,comprehension_continue_key.keys,comprehension_continue_key.rt,comprehension_continue_key.started,comprehension_continue_key.stopped,comprehension_continue_text.started,comprehension_continue_text.stopped,comprehension_repeat_text.started,comprehension_repeat_text.stopped,lab_thanks.started,lab_thanks.stopped,lab_key.keys,lab_key.rt,lab_key.started,lab_key.stopped,lab_introduction_continue.started,lab_introduction_continue.stopped,lab_members.started,lab_members.stopped,start_encoding_text.started,start_encoding_text.stopped,enc_instructions_1_text.started,enc_instructions_1_text.stopped,enc_instructions_1_image.started,enc_instructions_1_image.stopped,enc_instructions_1_key.keys,enc_instructions_1_key.rt,enc_instructions_1_key.started,enc_instructions_1_key.stopped,instructions_1_continue.started,instructions_1_continue.stopped,A vizsgálat feltételeibe (https://sites.google.com/view/magnesesrezonancia/vizsgálatok/online-vizsgálat) beleegyezem (igen/nem).,Az adatkezelési feltételeket (https://sites.google.com/view/magnesesrezonancia/vizsgálatok/online-vizsgálat) elfogadom (igen/nem).,Nem*,Kor*,Oktatás éve (oktatási intézményben eltöltött összes évek száma)*,date,expName,psychopyVersion,frameRate,
,,,,,,,,,,7.264030426998943,None,right,0.7936488710001868,17.25859349899838,None,,,,,,,,,,,,,,,,,,,,,,,,,,,,,,,,,,,,,,,,,,,,i,i,,,,2020_máj_18_0058,TRK-online,2020.1.0,554.4230232976118,
Mennyi időt vesz igénybe a vizsgálat? Válaszát jelölje a megadott billentyűk egyikével. ,D:20-30 perc    F: 50-60 perc    J: 70-80 perc,f,A helyes válasz: 50-60 perc,A helyes válasz: 50-60 perc,"Kérjük, figyelmesen olvassa végig az alábbi instrukciókat!

A vizsgálathoz használjon asztali számítógépet vagy laptopot. A vizsgálat nem végezhető el mobil eszközön, például okostelefonon vagy táblagépen. A feladatok elvégzéséhez szüksége lesz működő billentyűzetre és stabil internet kapcsolatra. Az optimális eredmény elérése érdekében Google Chrome, Firefox vagy Safari böngésző használata javasolt. Kérjük, használja a teljes képernyő módot.
A kísérlet teljes körű, zavartalan figyelmet igényel. A vizsgálat két feladatból áll, és elvégzése 50-60 percet vesz igénybe. Bizonyosodjon meg róla, hogy elég időt tud szánni a vizsgálatra. Ügyeljen arra, hogy telefont, vagy más eszközöket közben ne használjon, és kerülje a másokkal való interakciót.

A vizsgálat két feladatból áll, melyek során absztrakt képeket kell kiválogatnia a megadott szempontok szerint. A feladatok alatt és a feladatok között is lesz lehetősége rövid pihenőt tartani. ",0,0,0,0,,,,,,,17.25859349899838,None,18.074817643999268,None,18.074817643999268,None,j,0,1.6736821300000884,19.072129880998546,None,20.751364308998745,None,right,0.9387293110012251,23.77197494400025,None,23.77197494400025,None,22.77524706099939,None,,,,,,,,,,,,,,,,,,,,,,,i,i,,,,2020_máj_18_0058,TRK-online,2020.1.0,554.4230232976118,
"Megbizonyosodott róla, hogy biztosítottak a vizsgálat elvégzéséhez szükséges feltételek? Válaszát jelölje a megadott billentyűk egyikével. ","F: Nem, nincs lehetőségem nyugodt körülmények között elvégezni a feladatot.    J: Igen, körülményeim nyugodtak, az internet kapcsolat stabil, a feladatokra tudok szánni 60 percet.",j,Köszönjük!,"Bizonyosodjon meg róla, hogy elég időt tud a vizsgálatra szánni. ","Kérjük, figyelmesen olvassa végig az alábbi instrukciókat!

A vizsgálathoz használjon asztali számítógépet vagy laptopot. A vizsgálat nem végezhető el mobil eszközön, például okostelefonon vagy táblagépen. A feladatok elvégzéséhez szüksége lesz működő billentyűzetre és stabil internet kapcsolatra. Az optimális eredmény elérése érdekében Google Chrome, Firefox vagy Safari böngésző használata javasolt. Kérjük, használja a teljes képernyő módot.
A kísérlet teljes körű, zavartalan figyelmet igényel. A vizsgálat két feladatból áll, és elvégzése 50-60 percet vesz igénybe. Bizonyosodjon meg róla, hogy elég időt tud szánni a vizsgálatra. Ügyeljen arra, hogy telefont, vagy más eszközöket közben ne használjon, és kerülje a másokkal való interakciót.

A vizsgálat két feladatból áll, melyek során absztrakt képeket kell kiválogatnia a megadott szempontok szerint. A feladatok alatt és a feladatok között is lesz lehetősége rövid pihenőt tartani. ",0,1,1,1,,,,,,,,,24.724730283996905,None,24.724730283996905,None,j,1,2.006111588998465,25.72195179299888,None,27.735382183000183,None,None,,30.73270979019835,None,30.73270979019835,None,29.735051196999848,29.735051196999848,,,,,,,,,,,,,,,,,,,,,,,i,i,,,,2020_máj_18_0058,TRK-online,2020.1.0,554.4230232976118,
,,,,,,,,,,,,,,,,,,,,,,,,,,,,,,,,,,,,,30.73606024399851,None,right,1.4793461869994644,30.73606024399851,None,,,,,,,,,,,,,,,,,i,i,,,,2020_máj_18_0058,TRK-online,2020.1.0,554.4230232976118,
,,,,,,,,,,,,,,,,,,,,,,,,,,,,,,,,,,,,,,,,,,,31.732534470997052,None,30.73606024399851,None,32.22758660099862,None,33.72829921799712,None,33.72829921799712,None,right,1.0149763000008534,38.72551858299994,None,,,i,i,,,,2020_máj_18_0058,TRK-online,2020.1.0,554.4230232976118,
,,,,,,,,,,,,,,,,,,,,,,,,,,,,,,,,,,,,,,,,,,,,,,,,,,,,,,,,,38.72551858299994,None,,,,,,,,,,
