Question,Answer,CorrectResponse,CorrectAnswer,IncorrectAnswer,InfoRepeated,comprehension_questions_1.thisRepN,comprehension_questions_1.thisTrialN,comprehension_questions_1.thisN,comprehension_questions_1.thisIndex,experiment_information_text.started,experiment_information_text.stopped,experiment_information_key.keys,experiment_information_key.rt,experiment_information_key.started,experiment_information_key.stopped,experiment_information_continue.started,experiment_information_continue.stopped,comprehension_question_text.started,comprehension_question_text.stopped,comprehension_question_answers.started,comprehension_question_answers.stopped,comprehension_key.keys,comprehension_key.corr,comprehension_key.rt,comprehension_key.started,comprehension_key.stopped,comprehension_feedback_text.started,comprehension_feedback_text.stopped,comprehension_continue_key.keys,comprehension_continue_key.started,comprehension_continue_key.stopped,comprehension_continue_text.started,comprehension_continue_text.stopped,comprehension_repeat_text.started,comprehension_repeat_text.stopped,A vizsgálati feltételeket (https://sites.google.com/view/magnesesrezonancia/vizsgálatok/online-vizsgálat) elfogadom (igen/nem).,Az adatkezelési feltételeket (https://sites.google.com/view/magnesesrezonancia/vizsgálatok/online-vizsgálat) elfogadom (igen/nem).,Nem,Kor,Oktatás éve,date,expName,psychopyVersion,frameRate,
,,,,,,,,,,6.5319513639988145,None,right,1.0207431210001232,16.53014445900044,None,,,,,,,,,,,,,,,,,,,,,i,i,,,,2020_máj_14_1748,TRK-online,2020.1.0,719.7219800486469,
Mennyi időt vesz igénybe a vizsgálat? Válaszát jelölje a megadott billentyűk egyikével. ,D:20-30 perc    F: 50-60 perc    J: 70-80 perc,f,A helyes válasz: 50-60 perc,A helyes válasz: 50-60 perc,"Kérjük, figyelmesen olvassa végig az alábbi instrukciókat!

A vizsgálathoz használjon asztali számítógépet vagy laptopot. A vizsgálat nem végezhető el mobil eszközön, például okostelefonon vagy táblagépen. A feladatok elvégzéséhez szüksége lesz működő billentyűzetre és stabil internet kapcsolatra. Az optimális eredmény elérése érdekében Google Chrome, Firefox vagy Safari böngésző használata javasolt. Kérjük, használja a teljes képernyő módot.
A kísérlet teljes körű, zavartalan figyelmet igényel. A vizsgálat két feladatból áll, és elvégzése 50-60 percet vesz igénybe. Bizonyosodjon meg róla, hogy elég időt tud szánni a vizsgálatra. Ügyeljen arra, hogy telefont, vagy más eszközöket közben ne használjon, és kerülje a másokkal való interakciót.

A vizsgálat két feladatból áll, melyek során absztrakt képeket kell kiválogatnia a megadott szempontok szerint. A feladatok alatt és a feladatok között is lesz lehetősége rövid pihenőt tartani. ",0,0,0,0,,,,,,,16.53014445900044,None,17.57384405999983,None,17.57384405999983,None,f,1,0.6264256609974836,18.572046407000016,None,19.204118277997622,None,None,22.228572744699704,None,22.228572744699704,None,21.230110492997483,21.230110492997483,i,i,,,,2020_máj_14_1748,TRK-online,2020.1.0,719.7219800486469,
"Megbizonyosodott róla, hogy biztosítottak a vizsgálat elvégzéséhez szükséges feltételek? Válaszát jelölje a megadott billentyűk egyikével. ","F: Nem, nincs lehetőségem nyugodt körülmények között elvégezni a feladatot.    J: Igen, körülményeim nyugodtak, az internet kapcsolat stabil, a feladatokra tudok szánni 60 percet.",j,Köszönjük!,"Bizonyosodjon meg róla, hogy elég időt tud a vizsgálatra szánni. ","Kérjük, figyelmesen olvassa végig az alábbi instrukciókat!

A vizsgálathoz használjon asztali számítógépet vagy laptopot. A vizsgálat nem végezhető el mobil eszközön, például okostelefonon vagy táblagépen. A feladatok elvégzéséhez szüksége lesz működő billentyűzetre és stabil internet kapcsolatra. Az optimális eredmény elérése érdekében Google Chrome, Firefox vagy Safari böngésző használata javasolt. Kérjük, használja a teljes képernyő módot.
A kísérlet teljes körű, zavartalan figyelmet igényel. A vizsgálat két feladatból áll, és elvégzése 50-60 percet vesz igénybe. Bizonyosodjon meg róla, hogy elég időt tud szánni a vizsgálatra. Ügyeljen arra, hogy telefont, vagy más eszközöket közben ne használjon, és kerülje a másokkal való interakciót.

A vizsgálat két feladatból áll, melyek során absztrakt képeket kell kiválogatnia a megadott szempontok szerint. A feladatok alatt és a feladatok között is lesz lehetősége rövid pihenőt tartani. ",0,1,1,1,,,,,,,,,22.24153415299952,None,22.24153415299952,None,j,1,0.6610784849981428,23.23910080600035,None,23.904107649999787,None,None,26.902149109699167,None,26.902149109699167,None,25.904448471999785,25.904448471999785,i,i,,,,2020_máj_14_1748,TRK-online,2020.1.0,719.7219800486469,
